{
  "schema_version": 1,
  "slug": "google-compute-engine",
  "persona": "it-admin",
  "runtime": "pi",
  "updated_at": "2026-07-31T19:24:14Z",
  "steps": {
    "research": {
      "input_digest": "sha256:8d3ecba5bbeb6e47f04338fd7de718bc2bb7ffcdee4e4a952401d9c98b7ffee0",
      "inputs": {
        "model": "openrouter/openai/gpt-5.6-sol",
        "prompt_digest": "sha256:255c60266361ff6711b0b04829329485020218f5a0460f70aa30f30d9c1711fc",
        "reading_list": [
          {
            "path": "doctrine/glossary.md",
            "digest": "sha256:8d14a903b777a43a7e73f2612be0846195143f9a37ebf5b60815a49d28acbd8f"
          },
          {
            "path": "doctrine/shared.md",
            "digest": "sha256:7da98efa7ef9b5772be6346d54d6bd4fd230d0a2d62786016f7ee8265ff1b8db"
          },
          {
            "path": "doctrine/roles/technical-research.md",
            "digest": "sha256:88f093f873c705128a0a31eb38be298a2ee11f4d50815552739925337f8ac3ad"
          },
          {
            "path": "doctrine/speakeasy-setup.md",
            "digest": "sha256:8715948a90f95187a2e093e3dfbaccb2870423ee7c90aed4eeba5c418c0bb85e"
          }
        ],
        "artifacts": [],
        "params": {
          "provider": "google-compute-engine",
          "notes": "Speakeasy MCP Catalog: present name=\"com.googleapis.compute/mcp\""
        }
      },
      "outputs": [
        {
          "path": "research.md",
          "digest": "sha256:e73907176c3706c048863003c2449ab4cee6ebb82ed415bd57757b80ea212903"
        },
        {
          "path": "meta.yaml",
          "digest": "sha256:760a0c1f0d6b71e886a52f0ee6c9920c54e244b7d8b91de70c00e1ea0452f8d2"
        }
      ],
      "completed_at": "2026-07-31T19:24:14Z"
    },
    "draft": {
      "input_digest": "sha256:8ecc91d2ee29af50ec71ef73a4ceee583147197e8214516fc4e2d5fe35c5050f",
      "inputs": {
        "model": "openrouter/openai/gpt-5.6-sol",
        "prompt_digest": "sha256:ad649d12e8bf3882a1593555c0c4d31681ac50aa891177b1a8f766a563d85d6c",
        "reading_list": [
          {
            "path": "doctrine/glossary.md",
            "digest": "sha256:8d14a903b777a43a7e73f2612be0846195143f9a37ebf5b60815a49d28acbd8f"
          },
          {
            "path": "doctrine/shared.md",
            "digest": "sha256:7da98efa7ef9b5772be6346d54d6bd4fd230d0a2d62786016f7ee8265ff1b8db"
          },
          {
            "path": "doctrine/roles/writer.md",
            "digest": "sha256:d41f77accebf79a55b259d6483fafe4f8997c8e946e6ffa719e68bb16bde59f7"
          },
          {
            "path": "doctrine/personas/it-admin.md",
            "digest": "sha256:b76dc61236fa5c56390354a0d51d5b5ee666395bb65a2e993b79bd9aa9c1fd0d"
          }
        ],
        "artifacts": [
          {
            "path": "research.md",
            "digest": "sha256:e73907176c3706c048863003c2449ab4cee6ebb82ed415bd57757b80ea212903"
          },
          {
            "path": "meta.yaml",
            "digest": "sha256:760a0c1f0d6b71e886a52f0ee6c9920c54e244b7d8b91de70c00e1ea0452f8d2"
          }
        ],
        "params": {
          "provider": "google-compute-engine",
          "notes": "Speakeasy MCP Catalog: forced-catalog name=\"com.googleapis.compute/mcp\"",
          "persona": "it-admin"
        }
      },
      "outputs": [
        {
          "path": "external.md",
          "digest": "sha256:078fb971ccb382c447810b7f307cc7baa194719ecec16950f8fa1c8deaa04971"
        },
        {
          "path": "speakeasy.md",
          "digest": "sha256:33e7c33e792b4022b1415366b833aa3ebf1ce42b773dd674cc75bd15528bcaac"
        }
      ],
      "completed_at": "2026-07-31T19:24:14Z"
    },
    "review.fidelity": {
      "input_digest": "sha256:7bb87b70dfbf7b45e3e5301c6e9d582e26e744693aeb2a658227ef1d93356af6",
      "inputs": {
        "model": "openrouter/openai/gpt-5.6-sol",
        "prompt_digest": "sha256:2885ba720bba92fbed782f1ac13fdbd065c3f1a294302ee85792fc4f61866e1f",
        "reading_list": [
          {
            "path": "doctrine/glossary.md",
            "digest": "sha256:8d14a903b777a43a7e73f2612be0846195143f9a37ebf5b60815a49d28acbd8f"
          },
          {
            "path": "doctrine/shared.md",
            "digest": "sha256:7da98efa7ef9b5772be6346d54d6bd4fd230d0a2d62786016f7ee8265ff1b8db"
          },
          {
            "path": "doctrine/roles/fidelity.md",
            "digest": "sha256:f1c64906d2702d25c5db118f0a1a471b4962333a506c235ffebccf67413aa7f3"
          }
        ],
        "artifacts": [
          {
            "path": "research.md",
            "digest": "sha256:e73907176c3706c048863003c2449ab4cee6ebb82ed415bd57757b80ea212903"
          },
          {
            "path": "meta.yaml",
            "digest": "sha256:760a0c1f0d6b71e886a52f0ee6c9920c54e244b7d8b91de70c00e1ea0452f8d2"
          },
          {
            "path": "external.md",
            "digest": "sha256:078fb971ccb382c447810b7f307cc7baa194719ecec16950f8fa1c8deaa04971"
          },
          {
            "path": "speakeasy.md",
            "digest": "sha256:33e7c33e792b4022b1415366b833aa3ebf1ce42b773dd674cc75bd15528bcaac"
          }
        ],
        "params": {
          "provider": "google-compute-engine",
          "notes": "Speakeasy MCP Catalog: forced-catalog name=\"com.googleapis.compute/mcp\"",
          "persona": "it-admin",
          "dimension": "fidelity"
        }
      },
      "outputs": [
        {
          "path": "external.md",
          "digest": "sha256:078fb971ccb382c447810b7f307cc7baa194719ecec16950f8fa1c8deaa04971"
        },
        {
          "path": "speakeasy.md",
          "digest": "sha256:33e7c33e792b4022b1415366b833aa3ebf1ce42b773dd674cc75bd15528bcaac"
        }
      ],
      "completed_at": "2026-07-31T19:24:14Z"
    },
    "review.achievability": {
      "input_digest": "sha256:58a7cb77a4ac3cdeb58bea427f21ecbf9e3e1d0d66bd0c28c74997a495fbff36",
      "inputs": {
        "model": "openrouter/openai/gpt-5.6-sol",
        "prompt_digest": "sha256:0b287f892ece7611416030973e4b1952db4c173e3023930bf238685d39b79cdf",
        "reading_list": [
          {
            "path": "doctrine/glossary.md",
            "digest": "sha256:8d14a903b777a43a7e73f2612be0846195143f9a37ebf5b60815a49d28acbd8f"
          },
          {
            "path": "doctrine/shared.md",
            "digest": "sha256:7da98efa7ef9b5772be6346d54d6bd4fd230d0a2d62786016f7ee8265ff1b8db"
          },
          {
            "path": "doctrine/roles/review.md",
            "digest": "sha256:7eb1e560946bbc2656afdfbdbd26d85b3d4a5579818fc4bd6629d818ce251f69"
          },
          {
            "path": "doctrine/personas/it-admin.md",
            "digest": "sha256:b76dc61236fa5c56390354a0d51d5b5ee666395bb65a2e993b79bd9aa9c1fd0d"
          }
        ],
        "artifacts": [
          {
            "path": "research.md",
            "digest": "sha256:e73907176c3706c048863003c2449ab4cee6ebb82ed415bd57757b80ea212903"
          },
          {
            "path": "meta.yaml",
            "digest": "sha256:760a0c1f0d6b71e886a52f0ee6c9920c54e244b7d8b91de70c00e1ea0452f8d2"
          },
          {
            "path": "external.md",
            "digest": "sha256:078fb971ccb382c447810b7f307cc7baa194719ecec16950f8fa1c8deaa04971"
          },
          {
            "path": "speakeasy.md",
            "digest": "sha256:33e7c33e792b4022b1415366b833aa3ebf1ce42b773dd674cc75bd15528bcaac"
          }
        ],
        "params": {
          "provider": "google-compute-engine",
          "notes": "Speakeasy MCP Catalog: forced-catalog name=\"com.googleapis.compute/mcp\"",
          "persona": "it-admin",
          "dimension": "achievability"
        }
      },
      "outputs": [
        {
          "path": "external.md",
          "digest": "sha256:078fb971ccb382c447810b7f307cc7baa194719ecec16950f8fa1c8deaa04971"
        },
        {
          "path": "speakeasy.md",
          "digest": "sha256:33e7c33e792b4022b1415366b833aa3ebf1ce42b773dd674cc75bd15528bcaac"
        }
      ],
      "completed_at": "2026-07-31T19:24:14Z"
    }
  }
}
