{
  "schema_version": 1,
  "slug": "google-drive",
  "persona": "it-admin",
  "runtime": "cursor-sdk",
  "updated_at": "2026-07-29T20:51:07Z",
  "steps": {
    "research": {
      "input_digest": "sha256:8d0a614f514efe82daeccd6f42280855d50cd87d1c8423b77ec7815d7faa225b",
      "inputs": {
        "model": "gpt-5.6-sol",
        "prompt_digest": "sha256:3b79ac335ee0b509b454301f3d8eb1d9665aea3729404aa00d65e08433e6b4e5",
        "reading_list": [
          {
            "path": "doctrine/glossary.md",
            "digest": "sha256:8d14a903b777a43a7e73f2612be0846195143f9a37ebf5b60815a49d28acbd8f"
          },
          {
            "path": "doctrine/shared.md",
            "digest": "sha256:7da98efa7ef9b5772be6346d54d6bd4fd230d0a2d62786016f7ee8265ff1b8db"
          },
          {
            "path": "doctrine/roles/technical-research.md",
            "digest": "sha256:f82583e4ba9e92f061b09e6685b3a2640a1826f6fbc27ddac52e0db68387acaf"
          },
          {
            "path": "doctrine/speakeasy-setup.md",
            "digest": "sha256:8715948a90f95187a2e093e3dfbaccb2870423ee7c90aed4eeba5c418c0bb85e"
          }
        ],
        "artifacts": [],
        "params": {
          "provider": "google-drive",
          "notes": "Remote MCP endpoint: https://drivemcp.googleapis.com/mcp/v1. Official setup docs: https://developers.google.com/workspace/drive/api/guides/configure-mcp-server\n\nSpeakeasy MCP Catalog: absent"
        }
      },
      "outputs": [
        {
          "path": "research.md",
          "digest": "sha256:d86f3b66959e86f719a62988fdd0559a2e8c48ba6431aa24e1a204b448b284e8"
        },
        {
          "path": "meta.yaml",
          "digest": "sha256:4c5cfbdf33ce1b2ac4150b2cad92168b020c511d91ac0527bca92b0bc21af971"
        }
      ],
      "completed_at": "2026-07-29T20:51:07Z"
    },
    "draft": {
      "input_digest": "sha256:a421e6cbb8255d00a9fa02c0e9aabb394e20668a613b2800f62cb6ea50f0f2ea",
      "inputs": {
        "model": "gpt-5.6-sol",
        "prompt_digest": "sha256:bd455424d5c087fd914297fad0cf7749459452dbd94d00bd4e20e977e9fbb92b",
        "reading_list": [
          {
            "path": "doctrine/glossary.md",
            "digest": "sha256:8d14a903b777a43a7e73f2612be0846195143f9a37ebf5b60815a49d28acbd8f"
          },
          {
            "path": "doctrine/shared.md",
            "digest": "sha256:7da98efa7ef9b5772be6346d54d6bd4fd230d0a2d62786016f7ee8265ff1b8db"
          },
          {
            "path": "doctrine/roles/writer.md",
            "digest": "sha256:7b88b10bd5ce607985054abbdce5e6b742acc7074c1461f08d34321523e17799"
          },
          {
            "path": "doctrine/personas/it-admin.md",
            "digest": "sha256:b76dc61236fa5c56390354a0d51d5b5ee666395bb65a2e993b79bd9aa9c1fd0d"
          }
        ],
        "artifacts": [
          {
            "path": "research.md",
            "digest": "sha256:d86f3b66959e86f719a62988fdd0559a2e8c48ba6431aa24e1a204b448b284e8"
          },
          {
            "path": "meta.yaml",
            "digest": "sha256:4c5cfbdf33ce1b2ac4150b2cad92168b020c511d91ac0527bca92b0bc21af971"
          }
        ],
        "params": {
          "provider": "google-drive",
          "notes": "Remote MCP endpoint: https://drivemcp.googleapis.com/mcp/v1. Official setup docs: https://developers.google.com/workspace/drive/api/guides/configure-mcp-server\n\nSpeakeasy MCP Catalog: absent",
          "persona": "it-admin"
        }
      },
      "outputs": [
        {
          "path": "external.md",
          "digest": "sha256:320361bd2e513e1945ce2dd245669afd7e2c978411370af27a1f066420d36dd5"
        },
        {
          "path": "speakeasy.md",
          "digest": "sha256:34f0bc52adc55cc3e03722e7179c36a239e03594789b188c048117237fb04290"
        }
      ],
      "completed_at": "2026-07-29T20:51:07Z"
    },
    "review.fidelity": {
      "input_digest": "sha256:411238aec5f9efe12d919c7ddfe957954f5e69366e03167078f7693b5510c088",
      "inputs": {
        "model": "gpt-5.6-sol",
        "prompt_digest": "sha256:cb91cacc0c50621e5c913643f99937071ea75c9a7c0856ff8c6cc70fc568d861",
        "reading_list": [
          {
            "path": "doctrine/glossary.md",
            "digest": "sha256:8d14a903b777a43a7e73f2612be0846195143f9a37ebf5b60815a49d28acbd8f"
          },
          {
            "path": "doctrine/shared.md",
            "digest": "sha256:7da98efa7ef9b5772be6346d54d6bd4fd230d0a2d62786016f7ee8265ff1b8db"
          },
          {
            "path": "doctrine/roles/fidelity.md",
            "digest": "sha256:472ec8a2db648c822d126dea857d3f79e9c97a8e9b5fe6a997170bef3c8d2c22"
          }
        ],
        "artifacts": [
          {
            "path": "research.md",
            "digest": "sha256:d86f3b66959e86f719a62988fdd0559a2e8c48ba6431aa24e1a204b448b284e8"
          },
          {
            "path": "meta.yaml",
            "digest": "sha256:4c5cfbdf33ce1b2ac4150b2cad92168b020c511d91ac0527bca92b0bc21af971"
          },
          {
            "path": "external.md",
            "digest": "sha256:320361bd2e513e1945ce2dd245669afd7e2c978411370af27a1f066420d36dd5"
          },
          {
            "path": "speakeasy.md",
            "digest": "sha256:34f0bc52adc55cc3e03722e7179c36a239e03594789b188c048117237fb04290"
          }
        ],
        "params": {
          "provider": "google-drive",
          "notes": "Remote MCP endpoint: https://drivemcp.googleapis.com/mcp/v1. Official setup docs: https://developers.google.com/workspace/drive/api/guides/configure-mcp-server\n\nSpeakeasy MCP Catalog: absent",
          "persona": "it-admin",
          "dimension": "fidelity"
        }
      },
      "outputs": [
        {
          "path": "external.md",
          "digest": "sha256:320361bd2e513e1945ce2dd245669afd7e2c978411370af27a1f066420d36dd5"
        },
        {
          "path": "speakeasy.md",
          "digest": "sha256:34f0bc52adc55cc3e03722e7179c36a239e03594789b188c048117237fb04290"
        }
      ],
      "completed_at": "2026-07-29T20:51:07Z"
    },
    "review.achievability": {
      "input_digest": "sha256:f93e98d633301bd31e95dfb7d5730531a6c7406d512f77fae945b6a83ec472d8",
      "inputs": {
        "model": "gpt-5.6-sol",
        "prompt_digest": "sha256:5da0cf6dfcf7d6cc8a083825cd048f87c4d0ce7442683b67981efb98b8a97ca3",
        "reading_list": [
          {
            "path": "doctrine/glossary.md",
            "digest": "sha256:8d14a903b777a43a7e73f2612be0846195143f9a37ebf5b60815a49d28acbd8f"
          },
          {
            "path": "doctrine/shared.md",
            "digest": "sha256:7da98efa7ef9b5772be6346d54d6bd4fd230d0a2d62786016f7ee8265ff1b8db"
          },
          {
            "path": "doctrine/roles/review.md",
            "digest": "sha256:7eb1e560946bbc2656afdfbdbd26d85b3d4a5579818fc4bd6629d818ce251f69"
          },
          {
            "path": "doctrine/personas/it-admin.md",
            "digest": "sha256:b76dc61236fa5c56390354a0d51d5b5ee666395bb65a2e993b79bd9aa9c1fd0d"
          }
        ],
        "artifacts": [
          {
            "path": "research.md",
            "digest": "sha256:d86f3b66959e86f719a62988fdd0559a2e8c48ba6431aa24e1a204b448b284e8"
          },
          {
            "path": "meta.yaml",
            "digest": "sha256:4c5cfbdf33ce1b2ac4150b2cad92168b020c511d91ac0527bca92b0bc21af971"
          },
          {
            "path": "external.md",
            "digest": "sha256:320361bd2e513e1945ce2dd245669afd7e2c978411370af27a1f066420d36dd5"
          },
          {
            "path": "speakeasy.md",
            "digest": "sha256:34f0bc52adc55cc3e03722e7179c36a239e03594789b188c048117237fb04290"
          }
        ],
        "params": {
          "provider": "google-drive",
          "notes": "Remote MCP endpoint: https://drivemcp.googleapis.com/mcp/v1. Official setup docs: https://developers.google.com/workspace/drive/api/guides/configure-mcp-server\n\nSpeakeasy MCP Catalog: absent",
          "persona": "it-admin",
          "dimension": "achievability"
        }
      },
      "outputs": [
        {
          "path": "external.md",
          "digest": "sha256:320361bd2e513e1945ce2dd245669afd7e2c978411370af27a1f066420d36dd5"
        },
        {
          "path": "speakeasy.md",
          "digest": "sha256:34f0bc52adc55cc3e03722e7179c36a239e03594789b188c048117237fb04290"
        }
      ],
      "completed_at": "2026-07-29T20:51:07Z"
    }
  }
}
