{
  "schema_version": 1,
  "slug": "google-sheets",
  "persona": "it-admin",
  "runtime": "pi",
  "updated_at": "2026-07-31T20:56:10Z",
  "steps": {
    "research": {
      "input_digest": "sha256:391f4c3dc51ae780f4be080e1e64b30a79b21bfca874b26113352f0df7a3b78e",
      "inputs": {
        "model": "openrouter/openai/gpt-5.6-sol",
        "prompt_digest": "sha256:255c60266361ff6711b0b04829329485020218f5a0460f70aa30f30d9c1711fc",
        "reading_list": [
          {
            "path": "doctrine/glossary.md",
            "digest": "sha256:8d14a903b777a43a7e73f2612be0846195143f9a37ebf5b60815a49d28acbd8f"
          },
          {
            "path": "doctrine/shared.md",
            "digest": "sha256:7da98efa7ef9b5772be6346d54d6bd4fd230d0a2d62786016f7ee8265ff1b8db"
          },
          {
            "path": "doctrine/roles/technical-research.md",
            "digest": "sha256:88f093f873c705128a0a31eb38be298a2ee11f4d50815552739925337f8ac3ad"
          },
          {
            "path": "doctrine/speakeasy-setup.md",
            "digest": "sha256:8715948a90f95187a2e093e3dfbaccb2870423ee7c90aed4eeba5c418c0bb85e"
          }
        ],
        "artifacts": [],
        "params": {
          "provider": "google-sheets",
          "notes": "Speakeasy MCP Catalog: absent"
        }
      },
      "outputs": [
        {
          "path": "research.md",
          "digest": "sha256:45423034c34c13de0b04d201a03c59e6d92aa532568dd9c6d8abe6a8d1122be4"
        },
        {
          "path": "meta.yaml",
          "digest": "sha256:7a41e0410b68ce7d648690e9fee6e92a4f6ec99574e13ae3fc54d6029bf65ce0"
        }
      ],
      "completed_at": "2026-07-31T20:56:10Z"
    },
    "draft": {
      "input_digest": "sha256:4c7ab1528f30b6e4f36d9ccbac022cc17b4cbecfa6c20800a36ee57941e401d4",
      "inputs": {
        "model": "openrouter/openai/gpt-5.6-sol",
        "prompt_digest": "sha256:ad649d12e8bf3882a1593555c0c4d31681ac50aa891177b1a8f766a563d85d6c",
        "reading_list": [
          {
            "path": "doctrine/glossary.md",
            "digest": "sha256:8d14a903b777a43a7e73f2612be0846195143f9a37ebf5b60815a49d28acbd8f"
          },
          {
            "path": "doctrine/shared.md",
            "digest": "sha256:7da98efa7ef9b5772be6346d54d6bd4fd230d0a2d62786016f7ee8265ff1b8db"
          },
          {
            "path": "doctrine/roles/writer.md",
            "digest": "sha256:d41f77accebf79a55b259d6483fafe4f8997c8e946e6ffa719e68bb16bde59f7"
          },
          {
            "path": "doctrine/personas/it-admin.md",
            "digest": "sha256:b76dc61236fa5c56390354a0d51d5b5ee666395bb65a2e993b79bd9aa9c1fd0d"
          }
        ],
        "artifacts": [
          {
            "path": "research.md",
            "digest": "sha256:45423034c34c13de0b04d201a03c59e6d92aa532568dd9c6d8abe6a8d1122be4"
          },
          {
            "path": "meta.yaml",
            "digest": "sha256:7a41e0410b68ce7d648690e9fee6e92a4f6ec99574e13ae3fc54d6029bf65ce0"
          }
        ],
        "params": {
          "provider": "google-sheets",
          "notes": "Speakeasy MCP Catalog: overridden-custom-remote",
          "persona": "it-admin"
        }
      },
      "outputs": [
        {
          "path": "external.md",
          "digest": "sha256:5f487c19e76ec6690e348434b9e95b9cd07bcefea7b719298d4343c80c70d1d4"
        },
        {
          "path": "speakeasy.md",
          "digest": "sha256:aee9a2782a38482696970f17181d2c2b857ae243a7cf62f2cbd9477da8c7a208"
        }
      ],
      "completed_at": "2026-07-31T20:56:10Z"
    },
    "review.fidelity": {
      "input_digest": "sha256:f1df6a63f26ba4e4c9635ecd434713d6e6557dd7b8eeaa292d84dd36719ba227",
      "inputs": {
        "model": "openrouter/openai/gpt-5.6-sol",
        "prompt_digest": "sha256:2885ba720bba92fbed782f1ac13fdbd065c3f1a294302ee85792fc4f61866e1f",
        "reading_list": [
          {
            "path": "doctrine/glossary.md",
            "digest": "sha256:8d14a903b777a43a7e73f2612be0846195143f9a37ebf5b60815a49d28acbd8f"
          },
          {
            "path": "doctrine/shared.md",
            "digest": "sha256:7da98efa7ef9b5772be6346d54d6bd4fd230d0a2d62786016f7ee8265ff1b8db"
          },
          {
            "path": "doctrine/roles/fidelity.md",
            "digest": "sha256:f1c64906d2702d25c5db118f0a1a471b4962333a506c235ffebccf67413aa7f3"
          }
        ],
        "artifacts": [
          {
            "path": "research.md",
            "digest": "sha256:45423034c34c13de0b04d201a03c59e6d92aa532568dd9c6d8abe6a8d1122be4"
          },
          {
            "path": "meta.yaml",
            "digest": "sha256:7a41e0410b68ce7d648690e9fee6e92a4f6ec99574e13ae3fc54d6029bf65ce0"
          },
          {
            "path": "external.md",
            "digest": "sha256:5f487c19e76ec6690e348434b9e95b9cd07bcefea7b719298d4343c80c70d1d4"
          },
          {
            "path": "speakeasy.md",
            "digest": "sha256:aee9a2782a38482696970f17181d2c2b857ae243a7cf62f2cbd9477da8c7a208"
          }
        ],
        "params": {
          "provider": "google-sheets",
          "notes": "Speakeasy MCP Catalog: overridden-custom-remote",
          "persona": "it-admin",
          "dimension": "fidelity"
        }
      },
      "outputs": [
        {
          "path": "external.md",
          "digest": "sha256:5f487c19e76ec6690e348434b9e95b9cd07bcefea7b719298d4343c80c70d1d4"
        },
        {
          "path": "speakeasy.md",
          "digest": "sha256:aee9a2782a38482696970f17181d2c2b857ae243a7cf62f2cbd9477da8c7a208"
        }
      ],
      "completed_at": "2026-07-31T20:56:10Z"
    },
    "review.achievability": {
      "input_digest": "sha256:1222877683cf6c03a0353b7f7904a2f6865dd0bf72ab5ad3d4407e946fd34aae",
      "inputs": {
        "model": "openrouter/openai/gpt-5.6-sol",
        "prompt_digest": "sha256:0b287f892ece7611416030973e4b1952db4c173e3023930bf238685d39b79cdf",
        "reading_list": [
          {
            "path": "doctrine/glossary.md",
            "digest": "sha256:8d14a903b777a43a7e73f2612be0846195143f9a37ebf5b60815a49d28acbd8f"
          },
          {
            "path": "doctrine/shared.md",
            "digest": "sha256:7da98efa7ef9b5772be6346d54d6bd4fd230d0a2d62786016f7ee8265ff1b8db"
          },
          {
            "path": "doctrine/roles/review.md",
            "digest": "sha256:7eb1e560946bbc2656afdfbdbd26d85b3d4a5579818fc4bd6629d818ce251f69"
          },
          {
            "path": "doctrine/personas/it-admin.md",
            "digest": "sha256:b76dc61236fa5c56390354a0d51d5b5ee666395bb65a2e993b79bd9aa9c1fd0d"
          }
        ],
        "artifacts": [
          {
            "path": "research.md",
            "digest": "sha256:45423034c34c13de0b04d201a03c59e6d92aa532568dd9c6d8abe6a8d1122be4"
          },
          {
            "path": "meta.yaml",
            "digest": "sha256:7a41e0410b68ce7d648690e9fee6e92a4f6ec99574e13ae3fc54d6029bf65ce0"
          },
          {
            "path": "external.md",
            "digest": "sha256:5f487c19e76ec6690e348434b9e95b9cd07bcefea7b719298d4343c80c70d1d4"
          },
          {
            "path": "speakeasy.md",
            "digest": "sha256:aee9a2782a38482696970f17181d2c2b857ae243a7cf62f2cbd9477da8c7a208"
          }
        ],
        "params": {
          "provider": "google-sheets",
          "notes": "Speakeasy MCP Catalog: overridden-custom-remote",
          "persona": "it-admin",
          "dimension": "achievability"
        }
      },
      "outputs": [
        {
          "path": "external.md",
          "digest": "sha256:5f487c19e76ec6690e348434b9e95b9cd07bcefea7b719298d4343c80c70d1d4"
        },
        {
          "path": "speakeasy.md",
          "digest": "sha256:aee9a2782a38482696970f17181d2c2b857ae243a7cf62f2cbd9477da8c7a208"
        }
      ],
      "completed_at": "2026-07-31T20:56:10Z"
    }
  }
}
